{
  "topic": "MLBasic",
  "notebook_title": "Pokémon vs. Digimon: Why Generalization Works — An Interactive Tour of |H|, N, and the Hoeffding Bound",
  "source_artifacts": {
    "structure": "pipeline_outputs/02_notebook_structure.json",
    "analysis": "pipeline_outputs/03_cell_analysis.json"
  },
  "cells": [
    {
      "cell_id": "C01",
      "cell_type": "markdown",
      "source": "# Pokémon vs. Digimon: Why Generalization Works\n## An Interactive Tour of |H|, N, and the Hoeffding Bound\n\nImagine a single number — the **edge count** `e` of a creature's outline — and one question: *is this creature a Pokémon or a Digimon?* The simplest possible model is a single knob: call it Digimon when `e ≥ h`. This notebook uses that toy to attack a deep question in machine learning:\n\n> **Why do a larger training set $N$ and a smaller hypothesis set $|H|$ make a *sampled* training set trustworthy?**\n\nWe only ever see a finite, random slice of the world, yet we want guarantees about the *whole* world. When — and why — is that slice good enough?\n\n### What you'll be able to do\n- Build a threshold classifier $f_h$ and read $|H|$ as a measure of model complexity.\n- Compute the 0/1 loss (error rate) and watch it change as you move the threshold.\n- Tell apart the *ideal* hypothesis $h_{all}$ from the *empirically chosen* $h_{train}$, and measure the **generalization gap**.\n- State the good-training-set (uniform-deviation) condition and estimate $P(D_{train}\\text{ is bad})$ by Monte Carlo.\n- Derive and check the distribution-free guarantee $P(D_{train}\\text{ is bad}) \\le |H|\\cdot 2\\exp(-2N\\varepsilon^2)$.\n- Invert the bound into the sample-complexity rule $N \\ge \\log(2|H|/\\delta)/(2\\varepsilon^2)$ and reproduce $N \\ge 610$.\n- Quantify the bias–complexity tradeoff that motivates deep learning.\n\n### Roadmap\n\n| Section | Concept | What you'll do |\n|---|---|---|\n| C03 | Threshold classifier & $|H|$ | Define $f_h$, the hypothesis set, and model complexity |\n| C05 / C06 | Loss as error rate | Drag a threshold; sweep $H$ for the ideal $h_{all}$ |\n| C07 / C08 | Empirical vs ideal risk | Sample $D_{train}$, find $h_{train}$, measure the gap |\n| C09 / C10 | Good vs bad training set | State the condition; estimate $P(\\text{bad})$ |\n| C11 / C12 | Hoeffding + union bound | Derive the bound; compare theory vs experiment |\n| C13 | Sample complexity | Read off the required $N$ |\n| C14 | Complexity tradeoff | See the U-shape and the deep-learning resolution |\n\n> ℹ️ **All data in this notebook is synthetic** — a self-contained stand-in for the original Pokémon/Digimon images — so everything runs end-to-end in Colab with no downloads.",
      "generation_notes": "Title, motivation, seven objectives, and a 7-row roadmap table per C01 goal; synthetic-data note included."
    },
    {
      "cell_id": "C02",
      "cell_type": "code",
      "source": "# === Environment setup (the ONLY place we import libraries and create the RNG) ===\nimport numpy as np\nimport matplotlib.pyplot as plt\n\n# Interactive stack — verify it imports so every later widget cell is safe in Colab.\ntry:\n    import ipywidgets as widgets\n    from ipywidgets import interact, interact_manual, IntSlider, FloatSlider, Button, Output\n    _WIDGETS_OK = True\nexcept ImportError:\n    print('ipywidgets not found — run `!pip install ipywidgets` and re-run this cell.')\n    widgets = None\n    _WIDGETS_OK = False\n\nfrom IPython.display import display, clear_output\n\n# Inline figures in Colab/Jupyter; fall back gracefully outside IPython.\ntry:\n    get_ipython().run_line_magic('matplotlib', 'inline')\nexcept Exception:\n    try:\n        plt.switch_backend('Agg')\n    except Exception:\n        pass\n\nSEED = 7\n\ndef set_seed(seed=7):\n    '''Create and return a fresh seeded numpy Generator (reseeding is deterministic).'''\n    return np.random.default_rng(seed)\n\n# The single shared RNG used across the notebook.\nrng = set_seed(SEED)\n\n# --- shared plotting helpers ---\nCOLORS = {'pokemon': '#f0a500', 'digimon': '#2a6f97', 'accent': '#d62828', 'ideal': '#386641'}\n\ndef new_axes(figsize=(8, 4)):\n    '''Return a fresh (fig, ax).'''\n    fig, ax = plt.subplots(figsize=figsize)\n    return fig, ax\n\ndef style_axes(ax, title='', xlabel='', ylabel=''):\n    '''Light, consistent axis styling: labels, title, soft grid, despined.'''\n    if title:\n        ax.set_title(title, fontsize=12, fontweight='bold')\n    if xlabel:\n        ax.set_xlabel(xlabel)\n    if ylabel:\n        ax.set_ylabel(ylabel)\n    ax.grid(True, alpha=0.25, linewidth=0.7)\n    for spine in ('top', 'right'):\n        ax.spines[spine].set_visible(False)\n\nipw_ver = widgets.__version__ if _WIDGETS_OK else 'MISSING'\nprint(f'numpy {np.__version__}  |  ipywidgets {ipw_ver}')\nprint(f'Shared RNG ready (SEED={SEED}). Setup complete.')",
      "generation_notes": "Single setup cell: imports (guarded ipywidgets), %matplotlib inline, SEED/set_seed/rng, COLORS + new_axes/style_axes, version print."
    },
    {
      "cell_id": "C03",
      "cell_type": "markdown",
      "source": "## The model: a one-knob threshold classifier\n\nRecall the three-step ML recipe (here only as framing):\n\n1. **Pick a function with unknowns** — a family of candidate models.\n2. **Define a loss** — how wrong a model is.\n3. **Optimize** — search the family for the lowest-loss model.\n\nOur feature is a single number, the **edge count** $e$ of a creature's silhouette (Pokémon tend to have smoother outlines and fewer edges; Digimon more). That single number is the entire input.\n\n### Definition\n\n$$f_h(e) = \\begin{cases} \\text{Digimon} & \\text{if } e \\ge h \\\\ \\text{Pokémon} & \\text{if } e < h \\end{cases}$$\n\nWe fix the label convention **Digimon $= 1$ (positive), Pokémon $= 0$**.\n\nThe single unknown is the threshold $h$. The **hypothesis set** is every threshold we allow:\n\n$$H = \\{1, 2, \\dots, 10000\\}, \\qquad |H| = 10000.$$\n\n$|H|$ — the number of candidate functions — is our measure of **model complexity**.\n\n> **More candidate functions → easier to overfit. Why?** Hold that question; we answer it quantitatively in **C14**, after building up the loss, the generalization gap, and the Hoeffding bound.",
      "generation_notes": "Markdown model definition: f_h cases, label convention, H set-builder with |H|=10000, forward-reference to C14."
    },
    {
      "cell_id": "C04",
      "cell_type": "code",
      "source": "# === Build the synthetic 'universe' D_all (stand-in for ALL Pokémon & Digimon) ===\nEDGE_LO, EDGE_HI = 1000, 10000\nEDGE_RANGE = (EDGE_LO, EDGE_HI)\n\ndef make_universe(n_pokemon=819, n_digimon=971,\n                  pk_mean=4300.0, pk_std=1900.0,\n                  dg_mean=6200.0, dg_std=1900.0,\n                  edge_lo=EDGE_LO, edge_hi=EDGE_HI,\n                  generator=None):\n    '''Draw a synthetic population of edge counts for two overlapping classes.\n\n    Returns (e, y) with y == 1 for Digimon, y == 0 for Pokemon. Edge counts are\n    clipped to [edge_lo, edge_hi] BEFORE rounding so none escape the domain.\n    '''\n    if generator is None:\n        generator = rng\n    if pk_std <= 0 or dg_std <= 0:\n        raise ValueError('pk_std and dg_std must be positive.')\n    pk = generator.normal(pk_mean, pk_std, size=n_pokemon)\n    dg = generator.normal(dg_mean, dg_std, size=n_digimon)\n    e = np.concatenate([pk, dg])\n    e = np.clip(e, edge_lo, edge_hi)\n    e = np.round(e).astype(int)\n    y = np.concatenate([np.zeros(n_pokemon, dtype=int), np.ones(n_digimon, dtype=int)])\n    perm = generator.permutation(e.shape[0])\n    return e[perm], y[perm]\n\n# Materialize the FIXED universe from a fresh seeded generator so it is independent\n# of any later RNG consumption.\ne_all, y_all = make_universe(generator=set_seed(SEED))\n\nassert e_all.shape == y_all.shape and len(e_all) == 1790\nassert set(np.unique(y_all)).issubset({0, 1}) and int(y_all.sum()) == 971\nassert e_all.min() >= EDGE_LO and e_all.max() <= EDGE_HI and e_all.dtype.kind == 'i'\n\n# --- static preview: overlapping class histograms ---\nfig, ax = new_axes(figsize=(9, 4))\nbins = np.linspace(EDGE_LO, EDGE_HI, 46)\nax.hist(e_all[y_all == 0], bins=bins, histtype='stepfilled', alpha=0.55,\n        color=COLORS['pokemon'], label=f'Pokémon (n={int((y_all == 0).sum())})')\nax.hist(e_all[y_all == 1], bins=bins, histtype='stepfilled', alpha=0.55,\n        color=COLORS['digimon'], label=f'Digimon (n={int((y_all == 1).sum())})')\nstyle_axes(ax, title='The universe D_all: edge-count distributions overlap',\n           xlabel='edge count e', ylabel='count')\nax.legend()\nplt.show()\nplt.close(fig)\n\nprint(f'Universe ready: {len(e_all)} creatures '\n      f'({int((y_all==0).sum())} Pokémon, {int((y_all==1).sum())} Digimon), '\n      f'edge counts in [{e_all.min()}, {e_all.max()}].')",
      "generation_notes": "make_universe factory + materialized e_all/y_all/EDGE_RANGE, clip-before-round, domain asserts, static overlaid histogram preview."
    },
    {
      "cell_id": "C05",
      "cell_type": "code",